{
  "version": 2,
  "kind": "consumer_gpu_model_candidates",
  "status": "pilot-candidates-not-release",
  "as_of": "2026-09-21",
  "models": [
    {
      "profile_id": "gemma4-12b-it-q4-0",
      "display_name": "Google Gemma 4 12B IT QAT Q4_0 GGUF",
      "hf_repository": "google/gemma-4-12B-it-qat-q4_0-gguf",
      "hf_revision": "29d097773436b69ff9feafd636ab4cf873786537",
      "source_url": "https://huggingface.co/google/gemma-4-12B-it-qat-q4_0-gguf",
      "license_id": "Apache-2.0",
      "native_context_tokens": 262144,
      "pilot_context_tokens": 65536,
      "runtime_family": "llama-cpp",
      "tool_call_parser": "gemma4",
      "reasoning_parser": "gemma4",
      "thinking_policy": "disabled",
      "speculation_policy": "disabled-target-only-baseline",
      "stored_checkpoint_kind": "gguf-q4-0",
      "compute_path_policy": "record-resolved-path",
      "artifact_manifest_status": "complete-file-sha256-pinned",
      "deployment": {
        "artifact_kind": "gguf-single-file",
        "artifacts": [
          {
            "filename": "gemma-4-12b-it-qat-q4_0.gguf",
            "sha256": "93567e57a8fe10b23569b9d9ec38cd005deedf71e29477c421a4b83f418a538b",
            "size_bytes": 6975879296,
            "source_repository": null,
            "source_revision": null
          }
        ],
        "context_tokens": 65536,
        "frameworks": [
          "llama-cpp"
        ],
        "memory": {
          "full_attention_layers": 8,
          "full_kv_heads": 1,
          "full_kv_head_dimension": 512,
          "sliding_attention_layers": 40,
          "sliding_kv_heads": 8,
          "sliding_kv_head_dimension": 256,
          "sliding_cached_tokens": 1536,
          "kv_bytes_per_scalar": 2,
          "recurrent_state_slots": 0,
          "constant_state_bytes": 0,
          "runtime_overhead_bytes": 1468006400,
          "lazy_read_bytes": 0
        },
        "minimum_memory_bytes": 10020944000,
        "runtime_versions": {},
        "moe_runner_backend": null,
        "model_alias": "gemma4-12b-it-q4-0",
        "quantization": "Q4_0",
        "model_filename": "gemma-4-12b-it-qat-q4_0.gguf",
        "llama_cpp": null,
        "vllm": null
      },
      "device_evidence": [
        {
          "device_id": "nvidia-cuda",
          "architecture": "cuda",
          "evidence_level": "official-gguf-backend",
          "source_url": "https://huggingface.co/google/gemma-4-12B-it-qat-q4_0-gguf",
          "tested_input_tokens": null,
          "tested_output_tokens": null,
          "tested_concurrency": null,
          "aa_admission_state": "unqualified"
        },
        {
          "device_id": "amd-rocm",
          "architecture": "rocm",
          "evidence_level": "official-gguf-backend",
          "source_url": "https://github.com/ggml-org/llama.cpp",
          "tested_input_tokens": null,
          "tested_output_tokens": null,
          "tested_concurrency": null,
          "aa_admission_state": "unqualified"
        },
        {
          "device_id": "apple-silicon",
          "architecture": "metal",
          "evidence_level": "official-gguf-backend",
          "source_url": "https://github.com/ggml-org/llama.cpp",
          "tested_input_tokens": null,
          "tested_output_tokens": null,
          "tested_concurrency": null,
          "aa_admission_state": "unqualified"
        }
      ]
    },
    {
      "profile_id": "gemma4-26b-a4b-q4-0",
      "display_name": "Google Gemma 4 26B A4B IT QAT Q4_0 GGUF",
      "hf_repository": "google/gemma-4-26B-A4B-it-qat-q4_0-gguf",
      "hf_revision": "d1c082be9cf3c8a514acf63b8761f4b41935842e",
      "source_url": "https://huggingface.co/google/gemma-4-26B-A4B-it-qat-q4_0-gguf",
      "license_id": "Apache-2.0",
      "native_context_tokens": 262144,
      "pilot_context_tokens": 65536,
      "runtime_family": "llama-cpp",
      "tool_call_parser": "gemma4",
      "reasoning_parser": "gemma4",
      "thinking_policy": "disabled",
      "speculation_policy": "disabled-target-only-baseline",
      "stored_checkpoint_kind": "gguf-q4-0",
      "compute_path_policy": "record-resolved-path",
      "artifact_manifest_status": "complete-file-sha256-pinned",
      "deployment": {
        "artifact_kind": "gguf-single-file",
        "artifacts": [
          {
            "filename": "gemma-4-26B_q4_0-it.gguf",
            "sha256": "3eca3b8f6d7baf218a7dd6bba5fb59a56ee25fe2d567b6f5f589b4f697eca51d",
            "size_bytes": 14439363584,
            "source_repository": null,
            "source_revision": null
          }
        ],
        "context_tokens": 65536,
        "frameworks": [
          "llama-cpp"
        ],
        "memory": {
          "full_attention_layers": 5,
          "full_kv_heads": 2,
          "full_kv_head_dimension": 512,
          "sliding_attention_layers": 25,
          "sliding_kv_heads": 8,
          "sliding_kv_head_dimension": 256,
          "sliding_cached_tokens": 1536,
          "kv_bytes_per_scalar": 2,
          "recurrent_state_slots": 0,
          "constant_state_bytes": 0,
          "runtime_overhead_bytes": 1509949440,
          "lazy_read_bytes": 0
        },
        "minimum_memory_bytes": 17606063104,
        "runtime_versions": {},
        "moe_runner_backend": null,
        "model_alias": "gemma4-26b-a4b-q4-0",
        "quantization": "Q4_0",
        "model_filename": "gemma-4-26B_q4_0-it.gguf",
        "llama_cpp": null,
        "vllm": null
      },
      "device_evidence": [
        {
          "device_id": "nvidia-cuda",
          "architecture": "cuda",
          "evidence_level": "official-gguf-backend",
          "source_url": "https://huggingface.co/google/gemma-4-26B-A4B-it-qat-q4_0-gguf",
          "tested_input_tokens": null,
          "tested_output_tokens": null,
          "tested_concurrency": null,
          "aa_admission_state": "unqualified"
        },
        {
          "device_id": "amd-rocm",
          "architecture": "rocm",
          "evidence_level": "official-gguf-backend",
          "source_url": "https://huggingface.co/google/gemma-4-26B-A4B-it-qat-q4_0-gguf",
          "tested_input_tokens": null,
          "tested_output_tokens": null,
          "tested_concurrency": null,
          "aa_admission_state": "unqualified"
        },
        {
          "device_id": "apple-silicon",
          "architecture": "metal",
          "evidence_level": "official-gguf-backend",
          "source_url": "https://huggingface.co/google/gemma-4-26B-A4B-it-qat-q4_0-gguf",
          "tested_input_tokens": null,
          "tested_output_tokens": null,
          "tested_concurrency": null,
          "aa_admission_state": "unqualified"
        }
      ]
    },
    {
      "profile_id": "qwen38-27b-q4-k-m",
      "display_name": "Qwen3.8 27B Q4_K_M GGUF",
      "hf_repository": "unsloth/Qwen3.8-27B-GGUF",
      "hf_revision": "f1bfb127c64f7072bdd2cad55f258b9c8b2910fe",
      "source_url": "https://huggingface.co/unsloth/Qwen3.8-27B-GGUF",
      "license_id": "Apache-2.0",
      "native_context_tokens": 262144,
      "pilot_context_tokens": 65536,
      "runtime_family": "llama-cpp",
      "tool_call_parser": "qwen3_coder",
      "reasoning_parser": "qwen3",
      "thinking_policy": "enabled-medium-candidate",
      "speculation_policy": "disabled-target-only-baseline",
      "stored_checkpoint_kind": "gguf-q4-k-m",
      "compute_path_policy": "record-resolved-path",
      "artifact_manifest_status": "complete-file-sha256-pinned",
      "deployment": {
        "artifact_kind": "gguf-single-file",
        "artifacts": [
          {
            "filename": "Qwen3.8-27B-Q4_K_M.gguf",
            "sha256": "7e78da5d7e3ae28d178121f58646953305f3e5bd3cb46f4a75584e8b6c6fe169",
            "size_bytes": 17106775008,
            "source_repository": null,
            "source_revision": null
          }
        ],
        "context_tokens": 65536,
        "frameworks": [
          "llama-cpp"
        ],
        "memory": {
          "full_attention_layers": 16,
          "full_kv_heads": 4,
          "full_kv_head_dimension": 256,
          "sliding_attention_layers": 0,
          "sliding_kv_heads": 0,
          "sliding_kv_head_dimension": 0,
          "sliding_cached_tokens": 0,
          "kv_bytes_per_scalar": 2,
          "recurrent_state_slots": 1,
          "constant_state_bytes": 157286400,
          "runtime_overhead_bytes": 1633681408,
          "lazy_read_bytes": 0
        },
        "minimum_memory_bytes": 23192710112,
        "runtime_versions": {},
        "moe_runner_backend": null,
        "model_alias": "qwen38-27b-q4-k-m",
        "quantization": "Q4_K_M",
        "model_filename": "Qwen3.8-27B-Q4_K_M.gguf",
        "llama_cpp": null,
        "vllm": null
      },
      "device_evidence": [
        {
          "device_id": "nvidia-cuda",
          "architecture": "cuda",
          "evidence_level": "upstream-gguf-conversion",
          "source_url": "https://github.com/NVIDIA/local-ai-inference-recipes/blob/main/models/qwen/qwen3.8-27b/geforce-rtx/linux/llama-cpp/q4-k-m/recipe.yaml",
          "tested_input_tokens": null,
          "tested_output_tokens": null,
          "tested_concurrency": null,
          "aa_admission_state": "unqualified"
        },
        {
          "device_id": "amd-rocm",
          "architecture": "rocm",
          "evidence_level": "upstream-gguf-conversion",
          "source_url": "https://huggingface.co/unsloth/Qwen3.8-27B-GGUF",
          "tested_input_tokens": null,
          "tested_output_tokens": null,
          "tested_concurrency": null,
          "aa_admission_state": "unqualified"
        },
        {
          "device_id": "apple-silicon",
          "architecture": "metal",
          "evidence_level": "upstream-gguf-conversion",
          "source_url": "https://huggingface.co/unsloth/Qwen3.8-27B-GGUF",
          "tested_input_tokens": null,
          "tested_output_tokens": null,
          "tested_concurrency": null,